project_id,country,year_awarded,data_source,procurement_channel,funding_source,sector,project_type,contract_value_usd,contract_currency,contract_amount,contract_duration_original_unit,contract_duration_original,contract_duration_days,winning_firm_name,winning_firm_country,winning_firm_is_chinese,winning_firm_is_soe,number_of_bidders,if_single_bidder,bidder_country_lowest_price,bidder_lowest_price,bidder_country,bidder_price_currency,bidder_price,procurement_method,financing_linked_to_bid,financing_source_chinese,joint_venture,firm_registered_locally,record_id,notice_type,awarded_date,bid_reference_no,project_name,contract_url
P181079,Ecuador,2024,World Bank,MDB-financed,IBRD95550,Rural and Inter-Urban Roads; Public Administration - Transportation,consulting,,USD,64400.0,Month,48.0,1464,Individual Consultant,Ecuador,,,1,1,,,,,,Individual Consultant Selection,,,,1,OP00322650,Contract Award,2024/11/12,EC-MTOP-460984-CS-INDV,Ecuador: Emergency Resilient Reconstruction Project,https://projects.worldbank.org/en/projects-operations/procurement-detail/OP00322650
P167512,Haiti,2024,World Bank,MDB-financed,COFNC1930,Health; Public Administration - Health; Health Facilities and Construction,works,,USD,2536371.0,Month,12.0,366,WORLD FOOD PROGRAMME (WFP),Monde,,,1,1,,,,,,Direct Selection,,,,0,OP00322645,Contract Award,2024/10/31,HT-UGP-437419-CW-DIR,Strengthening Primary Health Care and Surveillance in Haiti,https://projects.worldbank.org/en/projects-operations/procurement-detail/OP00322645
P173125,Honduras,2024,World Bank,MDB-financed,IDA66960,"Public Administration - Water, Sanitation and Waste Management; Water Supply; Sanitation",consulting,,USD,26400.0,Month,12.0,366,Individual Consultant,Honduras,,,1,1,,,,,,Individual Consultant Selection,,,,1,OP00322347,Contract Award,2024/11/12,HN-SAG-403380-CS-INDV,Urban Water Supply Strengthening Project,https://projects.worldbank.org/en/projects-operations/procurement-detail/OP00322347
P168911,Argentina,2024,World Bank,MDB-financed,IBRD89990,Tertiary Education; Primary Education; Public Administration - Education; Secondary Education,consulting,,USD,5300.0,Day,45.0,45,Individual Consultant,Argentina,,,1,1,,,,,,Individual Consultant Selection,,,,1,OP00322158,Contract Award,2024/08/21,AR-ME-439945-CS-INDV,Improving Inclusion in Secondary and Higher Education,https://projects.worldbank.org/en/projects-operations/procurement-detail/OP00322158
P172605,Brazil,2024,World Bank,MDB-financed,IBRD91620,Health; Secondary Education; Primary Education; Social Protection; Other Public Administration,consulting,,BRL,2017512.0,Month,16.0,488,KRP CONSULTORIA EM TECNOLOGIA DE INFORMACAO LTDA,Brasil,,,1,1,,,,,,Request for Bids,,,,0,OP00321498,Contract Award,2024/08/21,BR-CASA CIVIL-382746-NC-RFB,Salvador Social Multi-Sector Service Delivery Project II,https://projects.worldbank.org/en/projects-operations/procurement-detail/OP00321498
P173861,Honduras,2024,World Bank,MDB-financed,IDA68680,Public Administration - Health,consulting,,HNL,5570841.28,Day,30.0,30,MACC MEDICAL S. DE R.L.,Honduras,,,1,1,,,,,,Direct Selection,,,,1,OP00321332,Contract Award,2024/10/11,HN-SESAL-453152-NC-DIR,Honduras COVID-19 Emergency Response Project,https://projects.worldbank.org/en/projects-operations/procurement-detail/OP00321332
P178663,Brazil,2024,World Bank,MDB-financed,IBRD95930,Central Government (Central Agencies); Insurance and Pension; Social Protection; ICT Services; Health,consulting,,USD,100000.0,Month,17.0,518,Individual Consultant,Brasil,,,1,1,,,,,,Individual Consultant Selection,,,,0,OP00321262,Contract Award,2024/11/04,BR-SEFAZ-PI-COMP3-CGE-442544-CS-INDV,Progestão Piauí: Public Sector Management Efficiency,https://projects.worldbank.org/en/projects-operations/procurement-detail/OP00321262
P172893,Latin America and Caribbean,2024,World Bank,MDB-financed,TFB8254,"Public Administration - Agriculture, Fishing & Forestry; Forestry; Fisheries",consulting,,USD,132000.0,Day,1058.0,1058,Individual Consultant,Ecuador,,,1,1,,,,,,Individual Consultant Selection,,,,0,OP00321042,Contract Award,2024/10/22,CI-WCS-436838,Integrated watershed management of the Putumayo-Içá river basin,https://projects.worldbank.org/en/projects-operations/procurement-detail/OP00321042
P173464,Jamaica,2024,World Bank,MDB-financed,TFB5467,Other Public Administration,consulting,,USD,14013.0,Month,9.5,290,Individual Consultant,Antigua and Barbuda,,,1,1,,,,,,Individual Consultant Selection,,,,0,OP00320696,Contract Award,2024/10/09,DO-INTEC-448613-CS-INDV,Critical Ecosystem Partnership Fund – Caribbean Hotspot Project,https://projects.worldbank.org/en/projects-operations/procurement-detail/OP00320696
P161798,Argentina,2024,World Bank,MDB-financed,IBRD87360,"Irrigation and Drainage; Other Water Supply, Sanitation and Waste Management; Public Administration - Water, Sanitation and Waste Management",consulting,,USD,6971.0,Day,61.0,61,Individual Consultant,Argentina,,,1,1,,,,,,Individual Consultant Selection,,,,1,OP00320422,Contract Award,2024/10/23,AR-UCEPO-449813-CS-INDV,Salado Integrated River Basin Management Support Project,https://projects.worldbank.org/en/projects-operations/procurement-detail/OP00320422
P157715,OECS Countries,2024,World Bank,MDB-financed,"IBRD88830, IDA62640, IDA62650, IDA62660, IDA62670",Capital Markets; Public Administration - Financial Sector,consulting,,USD,25000.0,Year,1.0,366,KIRK C. N. BROWN,Barbados,,,1,1,,,,,,Direct Selection,,,,0,OP00319724,Contract Award,2022/05/11,KN-ECPCGC-292676-CS-CDS,OECS MSME Guarantee Facility Project,https://projects.worldbank.org/en/projects-operations/procurement-detail/OP00319724
P170469,Honduras,2024,World Bank,MDB-financed,IDA64600,"Water Supply; Sanitation; Other Water Supply, Sanitation and Waste Management; Public Administration - Water, Sanitation and Waste Management",goods,,HNL,563500.0,Day,90.0,90,HONDURAS ESPAÑA CONSTRUCCIONES S. DE R.L. DE C.V. (HONESCON),Honduras,,,2,0,Honduras,1105373.38,Honduras; Honduras,HNL; HNL,1105373.38; 1616171.36,Request for Quotations,,,,1,OP00319747,Contract Award,2024/10/29,HN-AMDC-418513-GO-RFQ,TEGUCIGALPA: WATER SUPPLY STRENGTHENING PROJECT,https://projects.worldbank.org/en/projects-operations/procurement-detail/OP00319747
P179088,Brazil,2024,World Bank,MDB-financed,IBRD95840,Public Administration - Education; Public Administration - Social Protection; Central Government (Central Agencies); Sub-National Government; Public Administration - Health,consulting,,BRL,70000.0,Year,2.0,732,SÁ LEITÃO AUDITORES S/S,Brasil,,,6,0,Brasil,74400.00,Brasil; Brasil; Brasil; Brasil; Brasil; Brasil,BRL; BRL; BRL; BRL; BRL; BRL,158440.00; 137820.00; 195480.00; 100000.00; 95000.00; 74400.00,Request for Quotations,,,,0,OP00319104,Contract Award,2024/10/04,6-SEPLAN,Progestão Tocantins: Public Sector Management Efficiency,https://projects.worldbank.org/en/projects-operations/procurement-detail/OP00319104
P165870,Haiti,2024,World Bank,MDB-financed,IDAE0450,Other Public Administration,works,,USD,46618.03,Day,90.0,90,SOCIETE D’INGENIERIE ET RECONSTRUCTION D’INFRASTRUCTURE SOCIALE EN HAITI,Haïti,,,1,1,,,,,,Direct Selection,,,,0,OP00318932,Contract Award,2024/01/18,HT-UCP/MICT-402413-CW-DIR,Strengthening DRM and Climate Resilience Project,https://projects.worldbank.org/en/projects-operations/procurement-detail/OP00318932
P175672,Bolivia,2024,World Bank,MDB-financed,IBRD94370,"Public Administration - Agriculture, Fishing & Forestry; Other Agriculture, Fishing and Forestry; Agricultural Extension, Research, and Other Support Activities; Agricultural markets, commercialization and agri-business",consulting,,USD,69980.0,Day,90.0,90,Individual Consultant,Bolivia,,,1,1,,,,,,Individual Consultant Selection,,,,1,OP00318410,Contract Award,2024/06/20,BO-EMPODERAR-379660-CS-INDV,Innovation for Resilient Food Systems (Alianzas Rurales - PAR III) Project,https://projects.worldbank.org/en/projects-operations/procurement-detail/OP00318410
P177987,Belize,2024,World Bank,MDB-financed,IBRD93440,Health; Public Administration - Health; Health Facilities and Construction,goods,,BZD,194550.0,Month,3.0,92,BELIZE DIESEL & EQUIPMENT,Belize,,,1,1,,,,,,Request for Bids,,,,1,OP00317990,Contract Award,2024/10/22,BZ-MOHW-430444-GO-RFQ,Belize COVID-19 Response Project,https://projects.worldbank.org/en/projects-operations/procurement-detail/OP00317990
P173989,Trinidad and Tobago,2024,World Bank,MDB-financed,IBRD91570,Health Facilities and Construction; Health; Public Administration - Health,consulting,,USD,39000.0,Year,1.0,366,Individual Consultant,Trinidad and Tobago,,,1,1,,,,,,Individual Consultant Selection,,,,1,OP00318067,Contract Award,2022/09/20,TT-MOH-IC-3,Republic of Trinidad and Tobago: COVID-19 EMERGENCY RESPONSE PROJECT,https://projects.worldbank.org/en/projects-operations/procurement-detail/OP00318067
P159835,Mexico,2024,World Bank,MDB-financed,TFA7021,"Agricultural Extension, Research, and Other Support Activities; Public Administration - Agriculture, Fishing & Forestry; Agricultural markets, commercialization and agri-business",consulting,,USD,22920.0,Month,6.0,183,Individual Consultant,México,,,1,1,,,,,,Individual Consultant Selection,,,,0,OP00318062,Contract Award,2024/09/17,MX-SEMARNAT-433158-CS-INDV,Mexico: Sustainable Productive Landscapes Project,https://projects.worldbank.org/en/projects-operations/procurement-detail/OP00318062
P153012,Brazil,2024,World Bank,MDB-financed,IBRD87470,Sub-National Government; Tourism,consulting,,USD,150000.0,Month,7.0,214,CERTARE ENGENHARIA E CONSULTORIA LTDA,Brasil,,,1,1,,,,,,Consultant Qualification  Selection,,,,0,OP00318018,Contract Award,2024/10/17,BR-SEUMA-411711-CS-CQS,Fortaleza Sustainable Urban Development Project,https://projects.worldbank.org/en/projects-operations/procurement-detail/OP00318018
P172980,St. Vincent and the Grenadines,2024,World Bank,MDB-financed,TFB8353,"Fisheries; Public Administration - Agriculture, Fishing & Forestry",consulting,,USD,88000.0,Month,11.0,336,Individual Consultant,St. Vincent and the Grenadines,,,1,1,,,,,,Individual Consultant Selection,,,,1,OP00317691,Contract Award,2023/07/04,SVGCMEMS-C-IC-11,Coastal and Marine Ecosystems Management Strengthening Project,https://projects.worldbank.org/en/projects-operations/procurement-detail/OP00317691
P170860,St. Lucia,2024,World Bank,MDB-financed,IDA66530,Aviation; Public Administration - Transportation,consulting,,USD,44000.0,Month,13.0,396,Individual Consultant,Qatar,,,1,1,,,,,,Individual Consultant Selection,,,,0,OP00317685,Contract Award,2024/10/22,LC- SLASPA-443326-CS-INDV,Saint Lucia - Caribbean Regional Air Transport Connectivity Project,https://projects.worldbank.org/en/projects-operations/procurement-detail/OP00317685
P157575,Panama,2024,World Bank,MDB-financed,IBRD88340,"Other Water Supply, Sanitation and Waste Management; Other Education; Public Administration - Social Protection; Health Facilities and Construction; Health",consulting,,USD,13500.0,Month,9.0,274,Individual Consultant,Panamá,,,1,1,,,,,,Individual Consultant Selection,,,,0,OP00316698,Contract Award,2021/10/08,1.3.2.5.BPA-MINGOB / VMAI-233756-CS-INDV,Support for the National Indigenous Peoples Development Plan,https://projects.worldbank.org/en/projects-operations/procurement-detail/OP00316698
P164257,Jamaica,2024,World Bank,MDB-financed,TFA6559,"Fisheries; Public Administration - Agriculture, Fishing & Forestry",consulting,,USD,50000.0,Month,10.0,305,"MRAG LTD 18 QUEEN STREET, LONDON , W1J 5PN, UK TEL: +44 (0) 20 7255 7797 EMAIL : D.FAHRENHEIM@MRAG.CO.UK",United Kingdom,,,1,1,,,,,,Consultant Qualification  Selection,,,,0,OP00316217,Contract Award,2020/07/30,JM-MICAF-82599-CS-CQS-0,Promoting Community-based Climate Resilience in the Fisheries Sector,https://projects.worldbank.org/en/projects-operations/procurement-detail/OP00316217
P174812,Peru,2024,World Bank,MDB-financed,IBRD92880,Energy Transmission and Distribution; Public Administration - Energy and Extractives,consulting,,USD,167215.0,Day,90.0,90,Individual Consultant,Perú,,,1,1,,,,,,Individual Consultant Selection,,,,0,OP00316216,Contract Award,2024/06/06,PE-MINEM/DGER-378790-CS-INDV,Transmission Investment Plan (PIT) to support Post-COVID-19 Green Economic Recovery in Peru,https://projects.worldbank.org/en/projects-operations/procurement-detail/OP00316216
P164602,Brazil,2024,World Bank,MDB-financed,TFA8532,"Public Administration - Agriculture, Fishing & Forestry; Forestry; Livestock; Agricultural Extension, Research, and Other Support Activities",consulting,,BRL,50873.0,Month,18.0,549,"EVENTOS SENAR/MA, PERÍODO 09/05/2022 A 20/11/2023.",Brazil,,,1,1,,,,,,Request for Quotations,,,,1,OP00314949,Contract Award,2022/05/19,MA BR-SENAR-438767-NC-RFQ,Integrated Landscape Management in the Cerrado Biome Project,https://projects.worldbank.org/en/projects-operations/procurement-detail/OP00314949
P174707,Haiti,2024,World Bank,MDB-financed,IDAD9730,Public Administration - Education; Primary Education,goods,,USD,279790.0,Month,3.0,92,ANDRÉ BOISERIE,Haïti,,,3,0,Haïti,304965.00,Haïti; Haïti; Haïti,USD; USD; USD,351700.00; 323670.00; 304965.00,Request for Quotations,,,,0,OP00254539,Contract Award,2023/10/10,HT-PEQH-375349-GO-RFQ,"Promoting a more Equitable, Sustainable and Safer Education",https://projects.worldbank.org/en/projects-operations/procurement-detail/OP00254539
P164661,Mexico,2024,World Bank,MDB-financed,TFA6533,"Agricultural markets, commercialization and agri-business; Forestry",consulting,,MXN,453096.0,Day,15.0,15,SISTEMAS DE INFORMACIÓN GEOGRÁFICA S.A. DE C.V.,México,,,1,1,,,,,,Direct Selection,,,,0,OP00314688,Contract Award,2024/05/30,MX-CONAFOR-421359-GO-DIR,Strengthening Entrepreneurship in Productive Forest Landscapes,https://projects.worldbank.org/en/projects-operations/procurement-detail/OP00314688
P173872,El Salvador,2024,World Bank,MDB-financed,IBRD94290,Public Administration - Health; Health Facilities and Construction; Health,goods,,USD,130840.15,Day,60.0,60,"GRUPO MANTECH, S.A. DE C.V.",El Salvador,,,1,1,,,,,,Request for Quotations,,,,1,OP00284084,Contract Award,2024/04/09,RECOVID-205-RFQ-GO,El Salvador COVID-19 Emergency Response Project,https://projects.worldbank.org/en/projects-operations/procurement-detail/OP00284084
P162908,Haiti,2024,World Bank,MDB-financed,IDAD7420,"Agricultural Extension, Research, and Other Support Activities; Public Administration - Agriculture, Fishing & Forestry",consulting,,USD,20000.0,Month,2.0,61,Individual Consultant,Haïti,,,1,1,,,,,,Individual Consultant Selection,,,,0,OP00313891,Contract Award,2024/04/01,MARNDR/TPR/CI/QCIN-40/23,Resilient Productive Landscapes in Haiti,https://projects.worldbank.org/en/projects-operations/procurement-detail/OP00313891
P152117,OECS Countries,2024,World Bank,MDB-financed,IBRD87340,"Public Administration - Industry, Trade and Services; Tourism; Ports/Waterways; Public Administration - Transportation; ICT Infrastructure",consulting,,USD,476000.0,Month,18.0,549,INES INGENIEROS CONSULTORES,Spain,,,1,1,,,,,,Direct Selection,,,,0,OP00313324,Contract Award,2023/03/14,GD-PCU - GRENADA-335613-CS-CDS,OECS Regional Tourism Competitiveness,https://projects.worldbank.org/en/projects-operations/procurement-detail/OP00313324
P152281,Bolivia,2024,World Bank,MDB-financed,IBRD86480,Rural and Inter-Urban Roads; Public Administration - Transportation,consulting,,USD,21088.0,Day,138.0,138,Individual Consultant,Bolivia,,,1,1,,,,,,Individual Consultant Selection,,,,1,OP00313105,Contract Award,2024/08/12,BO-ABC-355822-CS-INDV,Santa Cruz Road Corridor Connector Project (San Ignacio - San Jose),https://projects.worldbank.org/en/projects-operations/procurement-detail/OP00313105
P174328,Honduras,2024,World Bank,MDB-financed,IDA69170,"Other Industry, Trade and Services; Agricultural markets, commercialization and agri-business; Public Administration - Industry, Trade and Services",consulting,,USD,115956.0,Month,4.0,122,Individual Consultant,Honduras,,,1,1,,,,,,Individual Consultant Selection,,,,1,OP00312593,Contract Award,2024/09/20,HN-SAG-426612-CS-INDV,Innovation for Rural Competitiveness Project - COMRURAL III,https://projects.worldbank.org/en/projects-operations/procurement-detail/OP00312593
P179746,Chile,2024,World Bank,MDB-financed,TFC3139,Other Energy and Extractives; Public Administration - Energy and Extractives,consulting,,USD,92500.0,Month,34.0,1037,Individual Consultant,Chile,,,1,1,,,,,,Individual Consultant Selection,,,,1,OP00312137,Contract Award,2024/05/31,3.3.1.1,Chile Partnership for Market Implementation,https://projects.worldbank.org/en/projects-operations/procurement-detail/OP00312137
P179210,Caribbean,2024,World Bank,MDB-financed,IDAE2860,Public Administration - Education,consulting,,USD,24000.0,Month,4.0,122,Individual Consultant,St. Lucia,,,1,1,,,,,,Individual Consultant Selection,,,,0,OP00312106,Contract Award,2024/08/08,LC-OECS COMMISSION -426345-CS-INDV,OECS- Skills and Innovation Project,https://projects.worldbank.org/en/projects-operations/procurement-detail/OP00312106
P162833,Peru,2024,World Bank,MDB-financed,IBRD89750,Law and Justice,consulting,,USD,36600.0,Month,7.0,214,Individual Consultant,Perú,,,1,1,,,,,,Individual Consultant Selection,,,,0,OP00311937,Contract Award,2022/07/13,PE-PJ-297507-CS-INDV,Improving the Performance of Non-Criminal Justice Services,https://projects.worldbank.org/en/projects-operations/procurement-detail/OP00311937
P144597,Bolivia,2024,World Bank,MDB-financed,IDA57440,Rural and Inter-Urban Roads; Public Administration - Transportation,consulting,,USD,543600.0,Month,6.0,183,MCLATAM S.A.,Argentina,,,1,1,,,,,,Quality And Cost-Based Selection,,,,0,OP00311155,Contract Award,2024/01/02,BO-ABC-238353-CS-QCBS,BO Road Sector Capacity Development Project,https://projects.worldbank.org/en/projects-operations/procurement-detail/OP00311155
P175616,Latin America and Caribbean,2024,World Bank,MDB-financed,TFB6011,Insurance and Pension,consulting,,USD,601219.3,Month,12.0,366,WILLIS RE INC,United States,,,1,1,,,,,,Request for Quotations,,,,0,OP00310535,Contract Award,2022/05/30,KY-CCRIF SPC-449019-NC-RFQ,Second Central America and Caribbean Catastrophe Risk Insurance Project,https://projects.worldbank.org/en/projects-operations/procurement-detail/OP00310535
P170658,Peru,2024,World Bank,MDB-financed,IBRD90390,Public Administration - Information and Communications Technologies; Other Public Administration; ICT Infrastructure; ICT Services; Other Information and Communications Technologies,goods,,USD,11870714.97,Month,18.0,549,"MOTOROLA SOLUTIONS, INC",Estados Unidos,,,3,0,Canadá,12544383.49,Canadá; Perú; Estados Unidos,USD,12544383.49,Request for Proposals,,,,0,OP00310000,Contract Award,2024/09/04,PE-PRONATEL-366200-GO-RFP,CENTRALIZED EMERGENCY RESPONSE SYSTEM PROJECT,https://projects.worldbank.org/en/projects-operations/procurement-detail/OP00310000
P164389,Mexico,2024,World Bank,MDB-financed,IBRD90490,"Public Administration - Water, Sanitation and Waste Management; Other Water Supply, Sanitation and Waste Management; Water Supply; Sanitation; Renewable Energy Solar; Renewable Energy Hydro",works,,MXN,5501173.19,Day,145.0,145,DR HYDRO SOLUCIONES AGRICOLAS S.A. DE C.V.,México,,,1,1,,,,,,Request for Bids,,,,0,OP00308873,Contract Award,2024/08/09,MX-CONAGUA-312680-CW-RFB,Water Security and Resilience for the Valley of Mexico (PROSEGHIR),https://projects.worldbank.org/en/projects-operations/procurement-detail/OP00308873
P163490,Haiti,2024,World Bank,MDB-financed,IDAD6690,Rural and Inter-Urban Roads; Public Administration - Transportation,consulting,,USD,65000.0,Week,20.0,140,BEJAMIN JADOTTE,Haiti,,,1,1,,,,,,Direct Selection,,,,1,OP00308854,Contract Award,2023/07/07,GG-CE-PARR-006,Haiti Rural Accessibility & Resilience Project,https://projects.worldbank.org/en/projects-operations/procurement-detail/OP00308854
P149522,Belize,2024,World Bank,MDB-financed,TFA2887,Energy Transmission and Distribution; Public Administration - Energy and Extractives,goods,,USD,1541716.99,Month,8.0,244,ANIXTER INC.,United States,,,1,1,,,,,,Request for Bids,,,,0,OP00308819,Contract Award,2024/08/30,BZ-BEL-98765-GO-RFB,Belize Energy Resilience for Climate Adaptation (GEF/SCCF),https://projects.worldbank.org/en/projects-operations/procurement-detail/OP00308819
P165695,Brazil,2024,World Bank,MDB-financed,IBRD89160,Water Supply; Sanitation,works,,BRL,58694492.86,Day,1170.0,1170,SANIT ENGENHARIA,Brazil,,,3,0,Brazil,64066950.33,Brazil; Brazil; Brazil,BRL; BRL; BRL,76902031.08; 86082325.92; 64066950.33,Request for Bids,,,,1,OP00308517,Contract Award,2024/07/15,BR-SABESP-371622-CW-RFB-CORREÇOES,SABESP - IMPROVING WATER SERVICE ACCESS AND SECURITY IN THE METROPOLITAN REGION OF SÃO PAULO PROJEC,https://projects.worldbank.org/en/projects-operations/procurement-detail/OP00308517
P175138,Argentina,2024,World Bank,MDB-financed,IBRD92320,Railways; Public Administration - Transportation,consulting,,USD,15800.0,Day,15.0,15,ESTUDIO VILLARES Y ASOCIADOS S.R.L,Argentina,,,1,1,,,,,,Direct Selection,,,,1,OP00307028,Contract Award,2024/06/14,AR-DGPPSE - ADIF-395730-CS-CDS,Buenos Aires – Mitre Passenger Railway Line Modernization Project,https://projects.worldbank.org/en/projects-operations/procurement-detail/OP00307028
P130682,Brazil,2024,World Bank,MDB-financed,IBRD83530,"Sanitation; Water Supply; Public Administration - Water, Sanitation and Waste Management; Forestry; Sanitation; Water Supply; Public Administration - Water, Sanitation and Waste Management; Forestry",consulting,,BRL,2142900.0,Day,30.0,30,DUALBASE TECNOLOGIA ELETRONICA LTDA,Brasil,,,1,1,,,,,,Request for Bids,,,,0,OP00306543,Contract Award,2022/07/14,SEAMA-1C4,BR Espirito Santo Integrated Sustainable Water Management Project,https://projects.worldbank.org/en/projects-operations/procurement-detail/OP00306543
P105680,Argentina,2024,World Bank,MDB-financed,IBRD92520,"Sanitation; Public Administration - Water, Sanitation and Waste Management; Other Water Supply, Sanitation and Waste Management; Water Supply; Other Transportation; Other Public Administration; Other Water Supply, Sanitation and Waste Management; Central Government (Central Agencies)",consulting,,USD,4000.0,Month,2.0,61,RICARDO CESAR SENESI,Argentina,,,1,1,,,,,,Direct Selection,,,,1,OP00305953,Contract Award,2024/07/30,AR-UCOFI-440339-CS-CDS,Matanza-Riachuelo Basin Sustainable Development Project,https://projects.worldbank.org/en/projects-operations/procurement-detail/OP00305953
P179845,Dominica,2024,World Bank,MDB-financed,,Renewable Energy Geothermal; Renewable Energy Solar,works,,USD,38967765.5,Month,30.0,915,KALPATARU PROJECTS INTERNATIONAL LIMITED,India,,,1,1,India,39696160.71,India,USD,39696160.71,Request for Bids,,,,0,OP00305729,Contract Award,2024/07/18,DM-DGDC-384816-CW-RFB,Dominica Geothermal Risk Mitigation II Project,https://projects.worldbank.org/en/projects-operations/procurement-detail/OP00305729
P159929,Argentina,2024,World Bank,MDB-financed,IBRD87120,Sub-National Government; Public Administration - Financial Sector,consulting,,ARS,14458600.0,Day,30.0,30,LATIN GRÁFICA S.R.L.,Argentina,,,2,0,Argentina,15800000.00,Argentina; Argentina,ARS; ARS,16100000.00; 15800000.00,Request for Quotations,,,,1,OP00305496,Contract Award,2023/10/17,AR-MDTH-375612-NC-RFQ,Integrated Habitat and Housing Project,https://projects.worldbank.org/en/projects-operations/procurement-detail/OP00305496
P178734,El Salvador,2024,World Bank,MDB-financed,IBRD95130,"Water Supply; Public Administration - Water, Sanitation and Waste Management; Sanitation; Other Water Supply, Sanitation and Waste Management",consulting,,USD,30000.0,Day,210.0,210,Individual Consultant,El Salvador,,,1,1,,,,,,Individual Consultant Selection,,,,1,OP00305449,Contract Award,2024/07/23,SV-ANDA-423226-CS-INDV,El Salvador Water Sector Resilience Project,https://projects.worldbank.org/en/projects-operations/procurement-detail/OP00305449
P170846,Dominica,2024,World Bank,MDB-financed,TFB9551,"Tourism; Public Administration - Industry, Trade and Services; Forestry",consulting,,USD,11560.0,Month,25.0,762,LOCHAN & CO. (CHARTERED ACCOUNTANTS,India,,,1,1,,,,,,Direct Selection,,,,0,OP00304375,Contract Award,2024/01/29,DM-MOERMKU-435735-CS-CDS,Leveraging Eco-Tourism for Biodiversity Protection in Dominica,https://projects.worldbank.org/en/projects-operations/procurement-detail/OP00304375
P170329,Argentina,2024,World Bank,MDB-financed,IBRD90070,Social Protection; Energy Transmission and Distribution; Public Administration - Social Protection,consulting,,USD,3321.0,Month,1.0,30,Individual Consultant,Argentina,,,1,1,,,,,,Individual Consultant Selection,,,,1,OP00255481,Contract Award,2023/03/13,AR-DPOMFB-311636-CS-INDV,Social Safety Nets for Vulnerable Populations in the Province of Buenos Aires,https://projects.worldbank.org/en/projects-operations/procurement-detail/OP00255481
P173773,Ecuador,2024,World Bank,MDB-financed,IBRD92280,Public Administration - Health; Health Facilities and Construction; Health,consulting,,USD,252855.45,Day,60.0,60,DHL GLOBAL FORWARDING ECUADOR S.A.,Ecuador,,,1,1,Ecuador,275000.00,Ecuador,USD,275000.00,Request for Quotations,,,,1,OP00304195,Contract Award,2022/09/02,EC-MPH-DFA-312392-NC-RFQ,Ecuador COVID-19 Emergency Response and Vaccination Project,https://projects.worldbank.org/en/projects-operations/procurement-detail/OP00304195
P172339,St Maarten,2024,World Bank,MDB-financed,TFB3014,Social Protection; Public Administration - Social Protection,consulting,,USD,15000.0,Day,8.0,8,KAGO KAGWI & ASSOCIATES,Kenya,,,1,1,,,,,,Direct Selection,,,,0,OP00303876,Contract Award,2021/05/21,SX-VNG INTERNATIONAL-236437-CS-CDS,St Maarten Civil Society Partnership Facility for Resilience Project (CSPFRP),https://projects.worldbank.org/en/projects-operations/procurement-detail/OP00303876
